Date Published,Overall Rating,Passenger Country,Trip Verified,Review Title,Review,Type Of Traveller,Seat Type,Origin,Destination,Layover,Date Flown,Seat Comfort,Cabin Staff Service,Food & Beverages,Ground Service,Value For Money,Recommended,Inflight Entertainment,Wifi & Connectivity,Aircraft
2023-05-13,1,United States,Trip Verified,"""Horrible customer service""","Horrible customer service. Bought the ticket the same day as the flight and I wasn’t able to check in because I was too late. Went to the counter and I was told to call the help desk. Call help desk told me to cancel my flight and get 10% back of what I paid and book a new flight at full price. Because they couldn’t do anything else all thought the next flight had empty seats. Overall bad experience, nobody care to help out.",Couple Leisure,Economy Class,Seuol,Tokyo,,May 2023,1.0,1.0,,1.0,1,no,,,
2023-05-11,1,Singapore,Not Verified,"""the worst airline ever!","This the worst airline ever. Upon checking in at the counter, we have realized that our check in baggage of 23kg is for per piece instead of the total weight. We were asked to top up for the additional luggage that we have. The seats were very stiff and uncomfortable as well.",Family Leisure,Economy Class,Singapore,Tokyo,,May 2023,1.0,1.0,,1.0,1,no,,,
2023-05-09,2,United States,Not Verified,"""already being treated poorly""","Okay so I’m currently at the airport right now and I’m already being treated poorly. When I first arrived to the gate, no one was at the ticket counter so I thought it’d be fine to sit inside. However a few minutes later the attendants returned and told me I had to wait outside to check my boarding pass, so I did. Then they started letting people sit at the gate after checking their boarding pass so I went and sat inside the gate while waiting for my flight. However, an hour before my schedule flight, the attendants came by again to kick out all the passengers from the gate because of “security reasons” so everyone had to wait outside the gate while the attendants boarded the plane. When the attendant came to kick me out, she told me politely to leave so I was packing my things but she clicked her tongue at me as I left. The price is cheap, but I found Hawaiian Airlines to be cheaper than ZipAir and never have been treated like this at any airline before, hence the poor review. Staff definitely needs more training since they assumed I couldn’t speak Japanese and kept muttering things under their breath like “tsk we can’t avoid (scary looking) passengers like that” or “(it’s annoying that) we have to keep repeating the same things” etc. These are just a few things I heard and I don’t think I’ll ever fly with Zipair again.",Solo Leisure,Economy Class,Hawaii,Japan,,May 2023,1.0,1.0,2.0,1.0,3,no,,1.0,
2023-05-09,4,Thailand,Not Verified,"""I was very disappointed""","I just traveled from Narita airport to Bangkok airport on 7th May 2023. That was my 4th time traveling with the airline and I was very disappointed. The counters opened 2 routes, Singapore and Bangkok, for checking in at the same time. It wasn't separated well and was very confusing. The C26 counter was said for Bangkok check-in, so I queued in the row for about 15 minutes aiming for it. But then, the C25 Singapore counter was free and called me out. I refused her because I was waiting for the C26 counter. She didn't understand and asked me why I queued in this row, so I told her counter C26 was said for Bangkok. She didn't believe me that C26 is for Bangkok and walked out from the counter. She realized her mistake when she saw the sign above the counter and the C26 staff told her that her counter was really for Bangkok. Although she realized it, she still didn't say any apologies to me and still asked me to queue again from the start in another row which I was frustrated. I don't understand why I had to waste time there about 30 minutes when I could finish it in 15 minutes.",Solo Leisure,Economy Class,Tokyo Narita,Bangkok,,May 2023,2.0,3.0,3.0,1.0,3,no,3.0,4.0,
2023-05-04,2,United States,Not Verified,"""I will be picking another airline next time""","The seats on the plane were uncomfortable. No entertainment. No free water or drinks or snacks, everything has to be purchased prior to take off or during flight for snacks and drinks. There was no AC that I could feel hot and uncomfortable. Staff members pick and choose to tell people to put your seatbelt on but will bypass some, maybe they feel uncomfortable to ask. It took a long time to check in. I will be picking another airline next time.",Family Leisure,Economy Class,Narita,Los Angeles,,May 2023,1.0,2.0,1.0,2.0,1,no,1.0,2.0,
2023-04-28,9,United States,Trip Verified,"""thoroughly content with my experience""","First off, I’m not a picky flyer by any means. I only get up from my seat to stretch occasionally and always bring my own entertainment options, no matter what is offered in-flight. I don’t need a lot of space or amenities to be content, even though I’m not a small guy. That was the initial attraction to ZIPAIR for me, not paying for things I wasn’t going to use. Entertainment? Bring your own (every seat has a USB-A charging port and they allow power banks, so don’t sweat the electrons). Meals, snacks, and drinks? Offered, but must be paid for separately either before you board, or in-flight via a browser interface using the plane’s WiFi system. Honestly, fine with me. I brought my own snacks and water on board, and used WiFi to order some drinks. The flights were incredibly smooth, the cabin staff were a vision of professionalism and care, the planes were spotless, and the seat comfort was better than expected despite being in Economy. For that matter, buying the tickets through the simple website was a breeze, check-in at the airports took less than 5 minutes, and because I kept my baggage simple, the tickets were vastly less expensive than other options. My only gripes were cabin temperatures - for some reason the cabin felt just a bit stifling both to and fro, and the air vents were on the anemic side - and the WiFi was a bit spotty. Honestly, these are relatively minor complaints (especially WiFi, hardly a necessity), and I feel these in no way diminished the value of what I saved on my fare. To sum up: I kept my expectations simple, and was thoroughly content with my experience flying with ZIPAIR. I will be using them again the next time I go to Japan.",Couple Leisure,Economy Class,San Jose,Tokyo,,April 2023,3.0,5.0,5.0,5.0,5,yes,,3.0,Boeing 787-8
2023-04-28,9,United Kingdom,Trip Verified,"""would definitely fly with again""","Very impressed. These seats are marketed as Business Class 'Lite' i.e.. you are getting a flat bed seat but not much else for the ticket price. However, I would actually rate the experience with Zip on this flight from Tokyo to Singapore more highly than my experiences with other airlines such as British Airways, who constantly disappoint. The value for money is way better that's for sure. As is the customer service. In summary: Check in process could have been better. Had to wait in queue for about half an hour. I think all passengers are required to manually check in at a desk for this flight. Or at least we were on this occasion. No fast track for business class. On the flight itself, the seats were very comfortable. The blanket provided was especially nice. As were the slippers. The restrooms were very clean and the toiletries provided were ample. Things like mouthwash, hand cream, etc. The staff were excellent. Polite, attentive, courteous. The food was good for what it was. I had spicy chicken with rice. It was basically a microwave meal but still tasty. The fruit was fresh and flavoursome. Free Wi-Fi for business class. Although this is a given on most premium seats, there are still airlines who cash in on charging for Wi-Fi (British Airways for example), so its nice that Zip provide it for free. I would definitely fly with Zip again.",Couple Leisure,Business Class,Tokyo,Singapore,,April 2023,4.0,5.0,4.0,3.0,5,yes,4.0,5.0,Boeing 787
2023-04-21,1,United States,Trip Verified,ZIPAIR customer review,"The seats are abysmal for a long-haul flight, both my wife and I had intense lower back pain around 8 hours in. No entertainment available onboard, they will advertise free Wifi, but it only worked about 20% of the time. As a low-cost airline, no meals, snacks or drinks are included, you have to pay in advance or onboard. You can’t even get a cup of water for free. Check-in procedure was horrific. No online checkin, the self-check kiosks did not work at Narita, luckily we arrived three hours early because it took nearly two to get through the line. If you have to fly this airline, be sure to get travel insurance. If you have the extra $100-200 to spare, fly with someone else, it’s worth it.",Couple Leisure,Economy Class,Los Angeles,Tokyo,,April 2023,1.0,2.0,1.0,1.0,1,no,,1.0,Boeing 787
2023-04-20,3,Singapore,Trip Verified,"""ZIPAIR staff seem clueless""","This is a warning about checkin at Narita. The self checkin machines don’t work. If you are not automatically checked in by the airline, don’t bother trying to use these machines. We were sent on a run around by their ground staff and by the time they tried to ‘help’ us self checkin, there was a huge line for the counter. Fortunately we got to the airport early. The ZIPAIR staff seem clueless & kept asking folk to use the self check in. Not typical Japanese efficiency. I guess you get what you pay for. Note too that biz class doesn’t have a separate checkin line. I’d recommend this airline only because they have the cheapest lie flat biz class seats on this route",Couple Leisure,Business Class,Tokyo,Singapore,,April 2023,3.0,3.0,,1.0,4,yes,,,
2023-04-16,2,Netherlands,Trip Verified,"""The worst airline I have been on""",The worst airline I have been on. The main problem are the checkin procedures in Seoul which were pathetic. The staff would not let us put in 1 x 23 kg bag even though we paid for 2 x 14kg bags. Apparently it breaks the rules even though we technically paid 30% more doing it this way. They also made us take out 3kg and put in our hand luggage because of some random policy. They then make you wait for 5-10 minutes while they check your bag for some unknown reason. None of it makes sense and is totally out of line with every other airline process globally. Avoid at all costs.,Couple Leisure,Economy Class,Seoul,Tokyo,,April 2023,3.0,3.0,,1.0,2,no,,,Boeing 787-8
2023-03-27,2,United States,Trip Verified,"""Horrible experience"" ","Horrible experience. I booked two round trip tickets from LA -> Tokyo and Singapore -> Tokyo. Of these four flights, three were delayed (by 2, 3, and 6 hours) and one was canceled a week prior.  On the flight back to LA, they failed at connecting the passenger bridge for 40 minutes and we had to disembark on the tarmac,",Family Leisure,Economy Class,Tokyo,Los Angeles,,March 2023,3.0,3.0,1.0,3.0,1,no,1.0,1.0,
2023-03-11,1,Singapore,Trip Verified,"""cancelled my flight 1 week to departure""","This is an absolutely disgusting airline, cancelled my flight 1 week to departure.  Now ticket prices are 3x what i bought, you really get what you pay with this kind of airline. Save yourself the headache and get a much reputable main carrier, now I am a firm believer of not using LCC.",Couple Leisure,Economy Class,Singapore,Tokyo,,March 2023,,,,,1,no,,,
2023-03-06,10,United States,Not Verified,"""I recommend ZIPAIR""","I recommend ZIPAIR. My friend and I booked a flight on Zipair because it was cheap. Once we booked we noticed the website was hard to navigate, the app we were supposed to download preflight isn't available in the US yet and there weren't many reviews. We Googled Zipair to make sure it was a real airline. The moment we checked in we realized this airline is real and it's an amazing deal. The customer service reps at check in asked if we'd been to Japan before and what we were excited about doing while quickly and efficiently checking us in. It was a great start but were concerned about seat comfort and inflight Wifi. As we entered the plane we realized seat comfort was not an issue. The seats were a clean, comfortable leather and had more leg space than most American carriers. Once we got in the air the Wifi connected quickly so we could access email and order food. It's not strong enough to download movies or tv shows so do that before you board. Food options are limited, they run out quick if you don't preorder. I suggest eat early or bring your own food. Beverages were comparably priced with other airlines and it didn't seem to run out of any drinks. The inflight staff was very attentive and kept trash out of the aisles and seat backs the entire flight. Our return trip from Tokyo to San Francisco was exactly the same. Friendly staff during check in, comfortable seats, quick WiFi for ordering food and checking email and very attentive flight attendants. My friend and I agreed we'd definitely recommend ZipAir to others and would fly them again.",Solo Leisure,Economy Class,San Francisco,Tokyo,,March 2023,5.0,5.0,4.0,5.0,5,yes,,5.0,
2023-03-04,2,United Kingdom,Trip Verified,"""strict carry on weight policy of 7KG""","They have a very strict carry on weight policy of 7KG. I was forced to put £5000 worth of lenses into checked luggage. No option to pay extra, wouldn't allow me to book an extra seat to double my luggage rate. I'm praying to god they are ok when I land. Staff on the desk didn't seem to grasp why this was such a huge issue or why a photogragher might easily carry more than 7KG in hand luggage.",Solo Leisure,Economy Class,Narita,Bangkok,,March 2023,2.0,3.0,,1.0,1,no,,,
2023-02-28,10,United States,Trip Verified,"""Excellent experience with ZIPAIR""","Excellent experience with ZIPAIR, from quick and very kind check in assistant, to a timely and pleasant flight. Was very lucky to get the seat with more leg space, so it was not as hard a night as I feared. I slept all night so no idea if there was food and how much it cost.",Couple Leisure,Economy Class,Singapore,Tokyo Narita,,February 2023,3.0,5.0,,5.0,5,yes,,2.0,
2023-02-07,10,United States,Trip Verified,"""Excellent flight""",Excellent flight. Almost empty flight. Had the entire row for both me and my partner. Should've saved money and not pay for seat assignment. Did have to pay for extra luggage but that was expected. No food ordered. Only hot food option on menu was a I think ravioli. Didn't matter as we had prepared food to eat on the plane. Ground crew was friendly and efficient. Flight crew was overworking unnecessarily by checking the overhead compartment every 30 minutes.,Couple Leisure,Economy Class,Los Angeles,Tokyo,,January 2023,5.0,5.0,,5.0,5,yes,5.0,3.0,Boeing 787
2023-02-01,10,United States,Trip Verified,"""business class seats were incredibly reasonable""",We chose Zipair because the business class seats were incredibly reasonable. The check-in process was easy and quite professional. Boarding was easy. The flight was great with the seats that went flat and allowed us to sleep a bit on a 9 hour flight. The food we pre-ordered was pretty good for airline food. The only negative is that the cabin crew never came by to check on whether we needed anything. Not a big deal. We think that Zipair is a very decent airline and hope we have the chance to fly again soon. My wife loved the business class seats. We got to LAX feeling better after a long flight than we ever have. Thank you!,Couple Leisure,Business Class,Tokyo,Los Angeles,,January 2023,5.0,4.0,4.0,5.0,5,yes,3.0,5.0,
2023-01-24,8,United States,Not Verified,"""would recommend this airline""","I flew on Zipair on my back from Tokyo Narita -> SJC. I had missed my airlines from (Singapore Airlines) which was headed to LAX, and Alaska Airlines connecting flight to SJC. I was in a huge bind because I had missed my original return flight and re-booking with Singapore airlines cost several thousand dollars + an additional fee of 300 dollars. Luckily I was able to book through ZIPAIR last minute and got a flight from NRT -> SJC directly for roughly 424 dollars. This saved me a lot of time and trouble and I had no problems with the airlines. It would be nice if they had a few more amenities or food but a roughly 10 hour direct flight which was offered last minute. Cannot complain and would recommend this airline. I am surprised for many of the other reviews which I am guessing have to do with refund issues or cancellations. I would book zipair if I was certain about my flight information and timings and didn't want to change.",Solo Leisure,Economy Class,Tokyo Narita,San Jose,,January 2023,4.0,4.0,4.0,4.0,5,yes,,,
2023-01-14,3,United States,Not Verified,"""has the worst customer service""","Zipair has the worst customer service. The check in employees at Narita airport are rude and unprofessional. When you try to contact them via phone, they tell you that communication is via email only. When you email customer service and you question them or disagree with anything, they will ghost you. I do not recommend this company.",Couple Leisure,Economy Class,Narita,Seoul,,November 2022,1.0,1.0,1.0,1.0,1,no,1.0,1.0,
2023-01-06,2,Singapore,Trip Verified,"""airline is a total rip-off for the extras""","This airline is a total rip-off for the extras. First airline that I have ever travelled with a restriction on the number of bags that can be attributed to a passenger for check-in. So that meant that even if I didn't hit the limit of 32kg extra baggage that I purchased out of my own pocket using 1 bag, the other bags cannot be checked in. Judging from the number of people who were also stuck at the check-in line, I know that this requirement is not clearly made known to passengers. Had to purchase for seat assignments. That itself was understandable since this is a budget airline. But the seat was not clearly indicated to be non reclining! Imagine 6hrs of sitting upright! Someone ought to be compassionate enough to indicate this to passengers just like what other airlines does.",Family Leisure,Economy Class,Singapore,Narita,,December 2022,1.0,1.0,,2.0,2,no,,,
2022-11-29,2,United Kingdom,Not Verified,"""I should not have to pay extra just to get a meal""",I paid a large amount of money for what is a 6 hour flight from Tokyo to Bangkok. The very least they can do is include food! I should not have to pay extra just to get a meal. I’ve been on many flights and every single one includes food if longer than 5 hours. Terrible.,Solo Leisure,Economy Class,Tokyo,Bangkok,,November 2022,4.0,4.0,1.0,4.0,1,no,1.0,5.0,
2022-11-21,10,United States,Not Verified,"""I cannot say enough good things about Zipair""","I cannot say enough good things about Zipair. First and foremost is the excellent price for a round trip ticket from LA to Tokyo. With the current exchange rate you can go Business class for under $2,000 R/T, or for under $900 if you fly economy. This is with all the upgrades added. You will spend a little more on snacks and drinks, but that is even cheap with our current exchange rates. The seats are all comfortable and their internet is free. I would recommend downloading some shows prior to take off as the internet did drop a couple of times.",Couple Leisure,Business Class,Los Angeles,Narita,,November 2022,5.0,5.0,4.0,5.0,5,yes,,4.0,Boeing 787-8
2022-11-11,9,United States,Trip Verified,"""I highly recommend ZipAir""","It was my first time with ZipAir and I was a bit leery of flying so far with a budget airline, but it was an enjoyable experience. Off to a good start, the check-in was fast and efficient. I flew in Standard (economy) class with 3-3-3 seating, which was comfortable with adequate legroom. The basic fare is only for the seat, but I opted for the ""value"" package to get 23 kg checked baggage, seat selection plus a meal (pre-selected from a picture menu) and still saved about $500 over the fares of established airlines. Passengers are required to show their boarding pass during flight to verify the optional upgrade. The tasty meal came in a box on a tray, with just beef and rice next to bottled water. There was no salad, dessert nor other drink, But the free Wi-Fi connected to my smart phone allowed ordering drinks and snacks later, as well as compensating for having no seatback screen. The charming cabin attendants were very safety conscious, double-checking to make sure overhead bins were closed securely. ZipAir should be commended for creating a unique budget flying experience on lengthy international flights. Some earlier negative Skytrax reviews were based on unmet pandemic regulations and refund policies, not the flights themselves, Overall, I highly recommend ZipAir as an alternative to traditional carriers whose fares have skyrocketed on the HNL-NRT route since the pandemic, Just follow the their common sense rules and enjoy the money saved.",Solo Leisure,Economy Class,Honolulu,Tokyo Narita,,November 2022,4.0,5.0,4.0,5.0,5,yes,3.0,4.0,Boeing 787
2022-11-10,5,Singapore,Trip Verified,"""insist I paid for another 23kg of luggage""","Twenty years in the film distribution business and never once has an airline refused to allow me to hand carry movie posters in a tube until my first flight with Zipair from NRT-SIN on Nov 4th 2022. They said my poster tube exceeded the dimensions of their overhead compartment. They insist that I paid for another 23kg of check-in luggage when my check-in luggage was 19.5kg of 23kg and my hand carry was only 4.5kg of 7kg. It was very clear that they did not want to listen to my explanation that my luggage was under weight and the poster tube weighed under 2kg. They kept saying that it is company policy. The flight was less than 20% occupied. A Very empty flight. The overhead compartment would have easily contained my poster tube with plenty of space to spare. Poster paper measures 27inch width and 39inch height rolled into a poster tube (cardboard) 2 inches longer than the poster's width.  The cabin crew were unsmiling patrolling the aisles like the police. I found them annoying as they made their presence felt, too much and gave out that I am watching you feeling. And it's not like they were giving out water. You have to pay for it. My pre-paid inflight meal was not bad. The expensive wagyu beef bowl is available and they seemed to have stopped selling their normal beef bowl.(minus points here) Purchased a can of Suntory Premium Beer and Pringles. Paid with a credit card but had to type in my details on their tablet. Prices were reasonable but I had to self-type all the cc details, etc for it to happen. Cash is not accepted for inflight sales. Otherwise, the flight was smooth., cabin was clean (hardly any pax) Less rigidity and friendly cabin crew may improve business. Keep your current attitude and Scoot will benefit most with their flexibility and surprisingly professional and charming cabin crew on my SIN-NRT flight on the same trip. Both flight tix were bought using the airline official website.",Solo Leisure,Economy Class,Tokyo Narita,Singapore,,November 2022,5.0,3.0,4.0,1.0,4,no,,2.0,Boeing 787
2022-10-30,1,Japan,Trip Verified,"""had me pay a fee to take the luggage""","Horrible experience. They say that my luggage is too big for cabin, because it doesn’t fit a small box they had. But inside the airplane there was not only plenty of space but I’ve flown with the same suitcase carry-on for years. So they had me pay a fee to take the luggage to checked baggage. I asked them if they can make it cheaper if I take stuff out. I had 15kg. They said no, 6500 yen is the cheapest. Then I looked on the website and the cheapest was under 14kg with 5500 yen. I came to the airport 3h before departure and waited and waited at the gate. I saw then boarding two other destinations (Singapore and Bangkok) before they started with Los Angeles (my destination). I went there one hour before departure because I was worried. They said that the gates are closed and we can’t het checked in, I said I was there for 3h and not once did I hear them call the LAX flight.  They eventually let all of us in and we managed to get on the plane.  I just wanted the minimum amount of respect and professionalism when dealing with customers. If one of them complains, it’s maybe the customer who’s crazy. But when you have 3 passengers not checked in because they didn’t know where/when to do it, then there must be a problem with your system.  Thirdly, they didn’t offer us water as a free service on a 10h flight. You had to buy it.",Solo Leisure,Economy Class,Tokyo Narita,Los Angeles,,October 2022,3.0,4.0,1.0,1.0,1,no,,,
2022-10-15,1,United States,Trip Verified,"""Very frustrating experience""",Very frustrating experience. Does not allow connecting flights at Tokyo during the time of COVID restrictions and does not inform this when making the reservation online. This is not clearly stated and feels very deceptive. Do not fly this airline and pay for something reputable.,Business,Economy Class,Bangkok,Tokyo,,October 2022,1.0,1.0,1.0,1.0,1,no,1.0,1.0,
2022-09-23,1,United States,Trip Verified,"""go with a reputable airline""","Los Angeles to Tokyo. DO NOT BOOK. There is a reason the flight costs are so low. They do not guarantee or stand by their brand. The airline would not allow us to fly due Japan restrictions and would not allow any re booking, credit or refund. Every single airline in COVID times, allowed options. They were difficult to speak with and only available via chat. Spend the extra money and go with a reputable airline.",Family Leisure,Business Class,Los Angeles,Tokyo,,June 2022,1.0,1.0,,1.0,1,no,,,
