Date Published,Overall Rating,Passenger Country,Trip Verified,Review Title,Review,Type Of Traveller,Seat Type,Origin,Destination,Layover,Date Flown,Seat Comfort,Cabin Staff Service,Food & Beverages,Ground Service,Value For Money,Recommended,Inflight Entertainment,Wifi & Connectivity,Aircraft
2024-02-25,1,United States,Trip Verified,"""ZIPAIR is not compensating me""","ZIPAIR refuses to compensate me for damaged baggage. After landing in NRT, I found that everything in my baggage was wet and the outside of the suitcase was wetter than the inside, indicating that liquid had entered from the outside. I contacted Zipair via email to ask for compensation. However, ZIPAIR is not compensating me; they only provided a document for me to submit to insurance. I do not have insurance that covers damaged baggage.",Solo Leisure,Economy Class,San Jose,Tokyo Narita,,February 2024,1.0,3.0,1.0,1.0,1,no,,,
2024-02-17,4,Philippines,Not Verified,"""can’t they be a little bit more lenient"" ","It is my first time to fly with ZIPAIR and knowing that it was a budget airline i didn’t really have high expectations. So when we came in the person on the counter asked us to put all our hand carry luggages all together, there are 3 of us so we should have 21kgs in total. It initially was 28kg all together which was way too much so we had to put the rest of our stuff inside the checked in luggages and then when we reweigh after it was 24kg. She still didn’t allow and wants us to remove more stuff so we opened our luggages again in front of the counter and transfered more stuff. I asked if we could just checked in 1 bag but she said since we only paid for 2 checked in luggages we can only check in 2 bags as well. So finally after the 3rd try it was now 20.8kg. Then it was finally time to weigh the 2 checked in luggages. I paid for x2 30kg luggages which in but ours in total was only 38kgs.  I mean can’t they be a little bit more lenient with the luggages i know there are policies but it just doesn’t make sense to me at all. I just don’t understand why they have to be so strict with the hand carry luggages when there were so much weight left with our checked in luggages anyway. And They both go on the same plane? What was weird for me too was that they weighed our hand carry first before the checked in luggages which was a first for me. I’ve never experienced this with other airlines.",Family Leisure,Economy Class,Tokyo,Manila,,February 2024,2.0,3.0,1.0,1.0,2,no,1.0,1.0,
2024-02-12,1,Japan,Not Verified,"""stewardesses were curt to me""","New plane with slightly spacious toilet. Nothing is included in the fare except the seat. Wifi is provided but spotty. Some devices cannot connect despite repeated tries. No free water. Poor choices of meals payable. The air stewardesses were curt to me, spoke limited English and told me outright no change of seats even though there were empty seats and we were allocated seats next to a giant who occupied 1.3z of a seat. One passenger could sleep over the entire row as there were 2 empty seats next to her. When we asked why she could occupy 3 seats when no change of seats was allowed the air stewardess loudly declared she is sick. I was queuing outside an occupied toilet but miraculously the stewardess manually opened the lock to allow a man with baby to pass me and the queue behind. So the toilet was not occupied why lock it and made us wait?",Couple Leisure,Economy Class,Narita,Singapore,,February 2024,2.0,1.0,,1.0,2,no,1.0,1.0,
2024-01-18,3,Canada,Trip Verified,"""The worst flight ever""","The worst flight ever. No meals even a glass of water. You have to order and pay. That is the only reason why they provide free wifi which it give a limited access. You have to use your own cell phone or pad to watch few movies which again, are dating for few years (around 10 movies from 2012 and 2020, no new movie. The passenger crew past all the time to assure your security and check your seat belt! Really not appreciated my 2 flights.",Solo Leisure,Economy Class,Tokyo,San Francisco,,January 2024,2.0,1.0,,1.0,1,no,,1.0,
2024-01-09,2,Singapore,Not Verified,“Selection of meals are poor”,Basic. Budget. Seats though new are small. Inflight meals and drinks are not served and you’ve just got to wait for them to reheat your food if you ordered. Inflight orders are suspended till much later in the flight. So pack your drinks and snacks. It doesnt seem like we’re getting served anytime soon. Ordered the katsu sandwich. It’s served cold. Yucks. Selection of meals are poor. Just snacks and majority are sweets with a few cup noodles on the very basic menu. Inflight shopping is poor too. I hope we last the flight! Not sure if we will fly it again. We feel neglected.,Family Leisure,Economy Class,Tokyo,Singapore,,January 2024,1.0,1.0,1.0,2.0,2,no,1.0,3.0,
2023-12-29,2,Philippines,Trip Verified,ZIPAIR customer review,After the food service on my way to the lavatory I pass by the galley and decided to give them my food carton from the food service that was served because no one was collecting around for the trash. The FA said please take it back we will collect later! We ordered the same food for everyone. While the FA was asking for our boarding pass i told her that my niece’s pass was with his father 1 row away. She got annoyed and her tone was like she was scolding us that we shouldn't do it the next time we board the flight. The 30KG max per bag allowance can't be split into two-three bags. No wifi working,Family Leisure,Economy Class,Manila,Narita,,December 2023,4.0,1.0,1.0,4.0,4,no,1.0,,
2023-12-29,2,United States,Not Verified,"""low price with low-quality""","It is low price with low-quality service so far. I used ZIPAIR twice because it was cheaper than any other airline and it is based on a Japanese company.  I experienced multiple uncomfortable moments.  We couldn't get TSA Pre-approved ticket. . As a result, we couldn't go through TSA line. When landed at Narita airport, a flight attendant asked us to leave soon when we were still making sure we didn't leave anything around our seat. Yes, we were one of the last people. Our luggage was not by our seat, so we needed to wait for others to leave first. I used to travel 4-6 times a year. I used many different airlines. But, it was my first time being asked to leave soon.  Wifi connection was disconnected multiple times. Low quality and poor connection. No free meal:  No screen and movies: That's okay. As long as I have WIFI connection. The selection of movies was out-dated. Extra cost for check-in luggage: You pay more for heavier luggage. That's okay it is still money-saving. Well, do I recommend Zipair? Yes for money saving with accepting low quality service.",Couple Leisure,Economy Class,San Francisco,Tokyo,,September 2023,3.0,2.0,,2.0,3,yes,1.0,2.0,
2023-12-20,5,United States,Trip Verified,"""you pay extra for everything""",For a budget airline it’s not bad you pay extra for everything and I knew this going into the flight. So I ordered two meals and had two waters. About 6 1/2 hours into my flight I went to the back of the plane and ask the attendant for a cup of ice to drink my water in so I could take my medicine. She said no ice on plane. Muffled with the post Covid mask on. I went back to my seat and drank my water and took my medicine.  The WiFi didn’t work on both legs unless you wanted to order something from the attendant. Plus you get to recheck bags traveling through Japan each way.,Solo Leisure,Economy Class,Tokyo,Los Angeles,,December 2023,3.0,2.0,2.0,4.0,3,no,1.0,1.0,
2023-12-14,1,Hungary,Trip Verified,"""didn't pay for seat reservation""",They are cramping together all people that don't purchase expensive seat reservations (100 usd). Despite airplane is 3/4 empty they won't allow you to take free seats but you will be forced to stay cramped since you didn't pay for seat reservation.,Family Leisure,Economy Class,Tokyo,Los Angeles,,December 2023,1.0,1.0,1.0,1.0,1,no,1.0,1.0,
2023-12-11,10,Denmark,Not Verified,"""Super nice budget airline""",Super nice budget airline. Clean and stylish interior. Super friendly staff. I fly from Lax to Tokyo for about 200 bucks. Brought my own food and drinks. Hard to beat!,Solo Leisure,Economy Class,Los Angeles,Tokyo,,December 2023,5.0,5.0,5.0,5.0,5,yes,1.0,1.0,
2023-12-04,1,Slovenia,Trip Verified,“Avoid this airline”,"Avoid this airline! Despite half airplane empty they didn't let us sit on empty rows. We had to suffer in cramped rows just because of ""their policy"". Staff treat passengers like cattle. We are never flying this airline again.",Couple Leisure,Economy Class,Tokyo,Los Angeles,,December 2023,1.0,1.0,1.0,1.0,1,no,1.0,1.0,
2023-11-16,3,Singapore,Trip Verified,"""made me pay for the extra luggage""","The staff at the counter appeared disinterested in providing good customer service. She did not greet me with a welcoming attitude, and  questioned why do I have so many luggage which I had only 2 bags with me instead of 1 bag. They made me pay for the extra luggage. Seats were also badly allocated  regardless was it a full flight or not, while we checked in together.  So insensitive of separating couples sitting with others couple's partner instead of having a couple in pair sitting together. I wrote in to Zipair on 31 Oct pertaining this matter via email & yet to receive any response from them. I was booked with SQ for a better returning experience.",Couple Leisure,Economy Class,Singapore,Tokyo,,October 2023,3.0,4.0,3.0,1.0,2,no,,1.0,ZG54
2023-11-04,2,United States,Trip Verified,"""rudest person I have come across""","I flew ZIPAIR from LAX in Los Angeles to Narita airport in Japan on 11/1. I had arrived a few minutes after the one-hour boarding deadline had passed. To my surprise, the friendly counter lady was able to check me in along with my two luggage cases and said I was fine with being a few minutes late. Obviously it wasn't my goal to be a few minutes late, but crazy traffic at LAX was the issue here even though I left my home 3 hours before my flight. The flight was smooth with no turbulence and the food was pretty decent. The movie library is pretty limited (only 9 movies), but enough to pass the time. The nightmare started to happen during my next leg of the trip (flight purchased separately) which was departing on 11/4 at 8:55AM from Narita airport in Japan to Incheon airport in Seoul. I had arrived at the check-in counter at around 7:53AM and was concerned about the one-hour boarding deadline. The counter lady was busy assisting another individual, and my wife and I were the last in line to be checked-in. The lady finished the other individual around 7:58AM and as I was heading to speak with her, she said I could not board because the hour deadline had passed. As you can imagine, I was livid and told her that it wasn't my fault she took so long to assist the passenger before me. I said it was not my fault as I had arrived at the line before 7:55AM. We had several back and forth encounters as you can imagine I am out several hundred dollars and she told me I had to book another flight since there were no more ZIPAIR flights leaving Narita that day. She was not helpful at all as I asked how to inquire for a refund. She said you'll get the taxes back. I then asked how do I do that? She said to contact customer service. I asked how do I do it? She said there's no phone number, you'll need to email them. I literally had to ask her questions by piecemeal. This was by far the rudest person I have come across after traveling to Japan several times this year. I will seriously question myself if I was to fly with them again.",Couple Leisure,Economy Class,Tokyo Narita,Seoul Incheon,,November 2023,3.0,4.0,4.0,1.0,3,no,3.0,4.0,
2023-10-15,7,United States,Not Verified,"""carryon bag has to be less than 7kg""","The seats were fine. pretty comfortable, not any more uncomfortable than other budget airlines, in fact more comfortable than many budget airlines. The main problem is they are too strict about carryon bag weight, it has to be less than 7kg. Everyone was slow to check in because their carry on bag was ""too heavy"" and they had to stuff more things in their checked bag (i had to as well). The person working there was nice enough to eventually give up and let me just take a normal amount of carryon with me instead of continuing to try and get it down to 7 pounds. the workers at narita airport check in seemed earnest and happy. There's a limited amount of movies and the internet is slow/non-functional during times when everyone is awake on the plane.",Solo Leisure,Economy Class,Tokyo Narita,San Francisco,,October 2023,5.0,5.0,3.0,5.0,5,yes,1.0,1.0,
2023-10-08,9,United States,Trip Verified,"""had a great experience""","I flew LAX-NRT on Zip Air and had a great experience. At LAX, Zip Air does have a separate line for people who book the lay flat seats and they are also now part of TSA precheck. It took a total of about 10 minutes from the time I walked into Tom Bradley terminal to check in and go through security. The seat was exactly what you would get on Japan Airlines business class just without anything extra. If you want anything beyond a great lay flat seat, you do have to pay, but I knew all this since it is pretty clear on their website so I downloaded some TV shows to my laptop, brought my own food and everything was fine. If you're like me and don't care about all the extras a regular business class fare offers then this is the airline for you.",Solo Leisure,Premium Economy,Los Angeles,Tokyo Narita,,September 2023,5.0,5.0,,5.0,5,yes,,4.0,Boeing 787
2023-09-19,1,United States,Trip Verified,"""being periodically harassed and ridiculed""","My review lays with being periodically harassed and ridiculed about an extension seat belt. Being that I am a plus size woman, I already came prepared and brought/bought my own seat belt extender that fit and connected the first flight to Narita no issues about the seat belt extender, however, there were still multiple times of being awaken out my sleep to pull an arm rest down or not have anything in my lap. Back to the initial complaint, on flight ZG026 to San Francisco on 9/18/23. I got to my seat and I over heard the flight attendants that did not wear name badges, speaking in Japanese about of have to make sure the fat lady has a seat belt extender. This the behavior you allow for your company. Then one comes up to me and pulls the seat belt and extends it then says you need an extender. Not ask but stated that I needed one. Still remaining calm I told her I already have one of my own and proceed to click it to get her smoothly. She leaves and talk with the previous attendant that was talking bad about me and comes back saying it’s not safe for me to use my own seatbelt extender belt. Then shoves theirs in my hand and says be sure to give this back at the end of flight and stayed until I removed mine and connected theirs to the seat belt. The attendant walks off says something else that I could not fully hear but definitely heard I’m going to mark her seat down so she doesn’t steals it to the previous attendant they both laugh. I proceeded to state I really don’t need this extension belt and you two are making me uncomfortable and we haven’t even taken off. They lie and says it’s policy and then walk off. Fast forward to 2/3 of the flight nearly ending the same attendant wakes me out of my sleep to tell me don’t forget to leave the extension belt in the seat when I leave. I calmly say ok even though I am boiling because of the assumption of assuming that I’m going to steal a extension belt extender, then when we land and the seatbelt light is off. I took off the seat belt and detached everything and left in the seat. The same harassing attendant comes up to me and demands I give her the seatbelt extender. I reach behind me and get it for her and said I thought you wanted me to leave it in the seat but please do take note that you have it back in your hands. Because I am not a thief and do not appreciate being harassed like one. I wish they had name plates so I can post it in this review. Lounge in narita was ok, the white seats are extremely stained and there’s no restroom inside it. In conclusion, this is the last time flying with ZIPAIR.",Solo Leisure,Economy Class,Tokyo Narita,San Francisco,,September 2023,1.0,1.0,3.0,1.0,1,no,1.0,1.0,
2023-09-08,5,United States,Trip Verified,"""purchase everything ahead of time""",Tokyo to San Jose. If you fly Zipair you have to purchase everything ahead of time: meals and drinks.,Solo Leisure,Economy Class,Tokyo,San Jose,,September 2023,3.0,2.0,1.0,3.0,3,no,,,Boeing 787-8
2023-09-07,2,United States,Not Verified,"""Very restrictive airline""",Very restrictive airline. They will nickle and dime you for anything you want. Nothing is offered free. Only allows each person 30 lbs combined of personal and carry on bag (thats about half their weight empty). They don't even offer you water on an 11 hour flight. Checked bags weight is overweight no matter what. Expect another $50 - $80 for each checked bag. Could not check in online. Could not print a boarding pass except at their desk. No frills. They usually get mad if you bring on your own food or drink too!,Couple Leisure,Economy Class,Tokyo,Los Angeles,,August 2023,1.0,1.0,1.0,2.0,1,no,1.0,1.0,
2023-08-08,1,Germany,Not Verified,"""no free food or beverage"" ","Flew in Full Flat, extra pay for suit case, no lounge and no free food or beverage during flight provided. Cabin crew extremely unprofessional and rude to me.",Solo Leisure,Economy Class,Manila,Tokio,,August 2023,4.0,1.0,1.0,2.0,1,no,,,
2023-07-31,3,United States,Trip Verified,"""no business lounge"" ","The ticket was sold as Full flat, but it was without business class amenities. No business check-in line, not supporting TSA, no business lounge.",Business,Economy Class,Los Angeles,Tokyo,,May 2023,2.0,1.0,,1.0,2,no,,,
2023-07-31,3,United States,Trip Verified,"""It is a budget airline at most""","The trip was so unpleasant, except for the ticket price. When I lined up to check in in the beginning, the staff recommended me to use its kiosks. She said it would save time. Well, she did not mention, the success rate for using kiosks is less than 10%. I ended up lining up again from the very end. The luggage check-in tooks forever for most of travelers.  It took me one and half hours to see the counter agent finally. My ticket was issued within 5 minutes. So i was puzzled why it took others so long. The boarding process was out of order. Nobody guided you how and where to line up. One staff just held a sign saying ""Row 45 and up"" boarding. But she could not be seen most of the time and the sign was up and down. Nobody paid any attention to it. Suddenly she announced ""All boarding"". Hundreds of traveler started to line up several lines for one gate. The entertainment options was limited and outdated. Luckily i downloaded my own movies and music the night before. Anyway, ZipAir does not have any characters of normal Japanese airline, efficient, polite and punctual. It is a budget airline at most. Avoid at all cost.",Solo Leisure,Economy Class,Tokyo,San Francisco,,July 2023,2.0,1.0,,1.0,3,no,1.0,,
2023-07-23,10,Denmark,Trip Verified,"""can highly recommend ZIPAIR""",A great experience! Everything was easy. Traveling with hand luggage we could use the boarding pass machines at check in. The boarding process went smooth. Inside the cabin we got good chairs with enough space for big and tall people. Free wifi during the flight was awesome. I can highly recommend ZIPAIR for your flight to Seoul!,Family Leisure,Economy Class,Narita,Seoul,,July 2023,5.0,5.0,,5.0,5,yes,5.0,5.0,
2023-07-21,8,Australia,Not Verified,"""a very pleasant experience""","My first time flying Zip Air was a very pleasant experience. Easy check in at Narita Airport, polite and helpful check in staff. The boarding was on time and very easy. The aircraft was clean and modern, the seats were 100% reclinable and Business cubes, you were provided a travel pack. The pre ordered meal was excellent and fresh. The flight attendant's were checking if I needed anything and appeared to enjoy their job. This low coast Japan Airlines owned Airline has changed what it is like to fly on a low cost carrier, I will definitely fly with them again. I hope they will increase their flight destinations. Am a real fan of Zip Air",Solo Leisure,Business Class,Tokyo,Bangkok,,July 2023,5.0,5.0,5.0,5.0,5,yes,,5.0,Boeing787
2023-07-18,1,Spain,Trip Verified,"""missed the ZIPAIR Tokyo flight""","My Spirit Airlines flight from NY to Detroit was delayed. I missed the Spirit Airlines flight from Detroit to LAX because of the delay. The next flight was 12 hours later. Got to LAX at 3pm and missed the ZIPAIR Tokyo flight. Talked to both airlines to resolve issue and both denied to offer me help. Had to ask other airlines for assistance. Zipair denied to help,  I have been sleeping in airports for 4 days now. I had paid for insurance but they didnt care.",Solo Leisure,Economy Class,Los Angeles,Tokyo,,July 2023,,,,1.0,1,no,,,
2023-07-05,1,United States,Not Verified,"""I was a couple minutes late""","I paid for three flights, but only flew once, and there's no refund. For the last flight I was supposed to take they wouldn't issue a boarding pass because I was a couple minutes late for their rule to check in 1 hour before departure. So, it ended up costing me over $2,000 to fly another airline because of their rule.",Business,Economy Class,Honolulu,Tokyo,,April 2023,1.0,2.0,1.0,1.0,1,no,,,
2023-06-14,8,United States,Not Verified,"""I’d highly recommend ZIPAIR""","A small bottle of water is $2. Cup of coffee $4. It is certainly easy enough to bring snacks/food from home, or pick something up from the airport, just be forewarned.  You will pay $50-$80 for any checked bags, up to three. They did not check the weight of my carry-on on the way to Japan, but did for the return flight. And as one of my checked bags was overweight, I had to re-distribute from on to another there at the check-in counter, but that was fine and the agent helped me so I didn’t have to pay for an additional suitcase. The seat was very comfortable, but you’re only able to partially recline it. There is no video screen, no in-flight entertainment, and the only Wi-Fi we were able to access went directly to their service site where you could order food and drinks. This is no frills but the airfare was $800 less than any other carrier. So even with a connecting flight on Southwest, and staying overnight in a hotel near the airport in San Jose (Hyatt Place, highly recommended) I still came out $500 under any other fare. The days when “getting there is half the fun” are long gone. But if you want a bargain flight price with nice attendants, excellent baggage handling, excellent crew, I’d highly recommend ZIPAIR.",Solo Leisure,Economy Class,San Jose,Tokyo,,May 2023,5.0,5.0,2.0,5.0,5,yes,1.0,1.0,Boeing 787-8
2023-06-13,3,United States,Trip Verified,"""there is no free water""","I asked the ground crew during check in if I can fill in my water bottle, and they said that the cabin crew will help. Later when I asked the cabin crew for water, they said there is no free water.",Solo Leisure,Economy Class,Tokyo,Honolulu,,June 2023,3.0,1.0,,2.0,3,no,,2.0,
2023-06-11,2,United States,Trip Verified,"""I was 5 mins late to check-in""","The customer service is horrible. Any mistakes you make during booking, they won’t able to change and require cancellation of booking. When that happen, they only partially refund your money. If you don’t check-in within 1 hour of departure at the counter you won’t able to fly.  The plane are small and they charge you on every single things including a plastic cup. And they picky about your carry-on weight. Overall, you think you save money by going cheap then its actually the opposite. You will spend a lot more money if you are late to the check-in. Or if you mess up the flight date. This is based on my experienced. Because those events above mention did happen to me. I was 5 mins late to check-in even when the plane departure is in 1 hour. They wouldn't check-in us in.",Couple Leisure,Economy Class,Tokyo,Los Angeles,,May 2023,,,,1.0,1,no,,,
2023-05-22,10,United States,Not Verified,"""Nothing to complain about really""","Nothing to complain about really, normal seats, OK food, good service, extra beer and wine for just a few $, orders go via inflight wifi and delivered straight to your seat. Free internet too but speeds are very slow. Overall, with the fare+bag fee+ seat fee+ food fee and extras it was still a few 100$ cheaper than flying with a major airline.",Couple Leisure,Economy Class,,,,May 2023,5.0,5.0,5.0,5.0,5,yes,3.0,3.0,
2023-05-18,1,United States,Trip Verified,"""I heard back 3 months later""",ZIPAIR completely broke my brand new luggage and refused to reimburse for damages. I filed an incident report at the baggage counter and I heard back 3 months later that the luggage (cracked and broken halfway through with multiple holes) was considered a 'scratch' and it 'happens'. I ironically bought the luggage the night before my flight so I wasted $400+ on its first flight with ZIPAIR. Wifi doesn’t work and there’s no TV to watch movies for the long flight. Cabin crew and food were the only decent experience for ZIPAIR.,Couple Leisure,Premium Economy,San Jose,Tokyo,,March 2023,2.0,3.0,3.0,2.0,2,no,1.0,1.0,
